{
  "id": "woo.suppress_marketplace_suggestions",
  "schema_version": 1,
  "title": "Hide WooCommerce marketplace suggestions",
  "category": "admin",
  "kind": "config",
  "risk": "safe",
  "base_confidence": 0.97,
  "reversible": true,
  "destructive": false,
  "handler": "runtime-handlers/woo-suppress-marketplace-suggestions.php",
  "params": {},
  "description": "Answers WooCommerce's woocommerce_allow_marketplace_suggestions filter, which turns off most of the panels offering paid extensions on the products, orders and settings screens. WooCommerce's own Show Suggestions setting still decides the rest. Notices are untouched, including a pending database update, a gateway that needs configuring, and the note that extension updates are waiting.",
  "breaks": [
    "Extension recommendations no longer appear on the products, orders and settings screens",
    "Partial: the extension link on the Shipping settings tab and the recommendations WooCommerce's newer admin screens load are still governed by WooCommerce's own Show Suggestions setting, which this does not change"
  ],
  "requires": [
    "fact:plugins.detected.woocommerce=true"
  ],
  "conflicts": [],
  "conditions": [],
  "measurements": [
    "admin.notices"
  ],
  "probes": [
    "admin"
  ],
  "effect": {
    "fact": "woo.marketplace_suggestions",
    "equals": false
  },
  "since_wp": "5.0",
  "docs_url": null
}
